titles,category
정권 바뀌자  미상 발사체 표현 완전히 사라졌다 안했나 못했나,Politics
 대통령 주재 첫 한미 확장억제 실질 조치,Politics
김규현 청문회서  세월호 보고 집중질타조작 혹은 위기관리 허술,Politics
권성동 대통령에 윤종원 반대 의견이준석 당정 인사 의견 교류,Politics
군 북 동해 상으로 탄도미사일 발 발사,Politics
이준석 윤종원 둘러싼 당정충돌 우려에 불협화음 아냐,Politics
경기도 기초단체장 판세는여야 모두 곳 이상 자신,Politics
권성동 대그룹 본예산 맞먹는 조 투자발표 이게 정권교체 효과,Politics
김기현 내로남불 민주당 사과 첫걸음은 대선패장 이재명송영길윤호중 인방 사퇴,Politics
안철수 사골 우린다는 이재명에 부인 때문에 소에 집착하나,Politics
영상 고성이 들려서 그러는데 혹시 어떤 말이 오고갔나요,Politics
속보영상 민주당 성남  수사 정치보복경찰청 항의 방문,Politics
 한미일 겨냥 단거리 함께 쐈다 확장억제 실질조치 지시,Politics
박지현 논의한 바 없다는 윤호중에 숙고 해야 하지 않나,Politics
북  포함 탄도미사일 발 발사한미 미사일 대응사격,Politics
뉴스 기념품 호 윤석열 대통령 시계 이렇게 생겼다호 증정은 취임식 국민희망대표,Politics
이재명   윤형선   조사서도 접전,Politics
이니굿즈 이어 열이굿즈 유행 윤석열 시계 선보였다,Politics
들쭉날쭉 여론조사에 후보캠프측 일희일비,Politics
지면 정치생명 끽  발언에이준석 정치 희화화 제정신 아닌 행동,Politics
김규현 세월호 유가족에 사죄 온 마음으로 죄송종합,Politics
민주당 세월호 참사 부실대응 김규현 국정원장 후보자 질타,Politics
안철수 내가 사골이재명 부인 때문에 소에 집착하나,Politics
국정원장 청문회서 세월호 보고시간 공방 작당한 게 팩트종합,Politics
사전투표  김은혜 저격으로 뭉친 민주당,Politics
김근식  김정은에 핵단추 누르면 공멸 보여줘야,Politics
인사검증 소통령 한동훈 논란에 민주국힘 설전,Politics
이재명 목에 손 그으며 끽이번에 지면 정치생명 끝장 영상,Politics
 내일은 미사일 발사 공개할까,Politics
윤 대통령 첫  주재이례적 정부 성명까지,Politics
김용태 민주 용퇴 해봐야 고민정김남국김용민이 자리메워,Politics
김진표 법무부가 인사검증 하려면 법 개정해야개인정보 수사에 쓸지 몰라,Politics
정부 수석 윤종원 발탁 놓고 당정 충돌 조짐권성동 불가,Politics
북  포함 탄도미사일 발 발사한미 미사일 대응사격,Politics
영상 중러 군용기 대 독도인근 카디즈 진입통상적 연합전략비행,Politics
국민의힘 이재명김동연에 화력 집중민주당 김은혜 역공,Politics
민주당 저희 잘못 회초리 맞겠다국힘 평가절하,Politics
팩트체크 미국에선 응답률  이하 여론조사는 발표 못 하게 한다,Politics
 천안연장 수도권의 확장 충청의 아들 이 지원 김태흠 밀어준 국힘,Politics
서민교수 작심폭로 일파만파 진중권과 연 끊어인간에 대한 예의 없어,Politics
북한 군인 코로나 확진 사망열병식서 확산,Politics
지방선거 투표율  후반 전망여야 유불리는,Politics
한동훈에 민정수석 권한 차지철이 되살아왔다,Politics
대통령 젠더 의식 변했나대통령실 더 많은 여성 쓰려 노력,Politics
이재명 손으로 목 그으며 끽이준석 제 정신 아냐,Politics
권성동 충청의 아들 윤석열 충남에 아낌없는 지원 약속,Politics
이재명 목에 손대며 끽이준석 제정신 아닌 행동,Politics
이재명 초접전 위기감에민주 지지층 결집 돌파 시도,Politics
검찰 왕국 전락  인수위 때 결정된 사안,Politics
여름 재유행 만만 예측소쿠리 투표 반복 않겠다종합,Politics
 수석 윤종원 국무조정실장 내정 권성동 에게 우려 전달,Politics
 도발 보고 즉시  소집  시간 뒤 미사일 응사,Politics
 바이든 귀국 중 미사일 발사 행보에 반발,Politics
 탄도미사일 섞어 쏘기 시간 뒤 맞대응 사격훈련,Politics
윤  긴급 소집안보리 결의 정면 위반,Politics
강용석 김은혜 거부에 완주 무소속 돌풍 함량미달  덕분,Politics
뉴스앤이슈 지방선거  박지현 호소문 발표에에 민주당 내홍 증폭,Politics
김규현 국정원장 후보자 청문회서  세월호 보고조작 집중 난타,Politics
머리 못 만지고 출근 서두른 윤 대통령  도발 분 만에  주재,Politics
이재명 일정 비우고 숨 고르기지지율 하락에 궤도 수정하나,Politics
황교익  부부 합창단 사진  동급 저격에대변인이 올린  사진,Politics
윤호중 이게 지도부냐 박지현 왜 앉혀놨나비공개 회의서 정면충돌,Politics
 수석 출신 윤종원에 불가론 제동,Politics
북 단거리 섞어쏘기는 처음미사일방어망 무력화 노려,Politics
영상 이재명 손으로 목 그으며 지면 정치생명 끝,Politics
 호 굿즈는 손목시계용산서 선물 받는 주인공 누구,Politics
깜깜이  송영길  오세훈 김동연  김은혜 ,Politics
  등 다른 종류 미사일 한 번에 섞어 쏘며 무력시위,Politics
 강남북 압도적 우세  대 콘크리트 지지층도 흔들,Politics
 여당 프리미엄윤석열 마케팅 앞세워 우세 굳히기,Politics
김규현 확진자 명  발표 사실과 거리 있다고 생각,Politics
이준석 내일 아산서 아침 인사충남승리 위해 추가 지원 약속,Politics
한미 연합 미사일 대응사격 쏜 발은  등 다종 도발,Politics
김태흠 후보님 어항에 금붕어 키우면 수산업입니까 지방선거,Politics
박지현 난 왜 뽑았냐 연이틀 강경 목소리투톱 윤호중과 정면충돌종합,Politics
이재명  윤형선 안철수  김병관 ,Politics
민주 법무부 인사검증 논란에한동훈 상왕 위법적 권한위임 맹폭 종합,Politics
김규현 청문회  세월호 보고 조작 집중추궁는 엄호,Politics
 이재명 맹공이준석 정치생명 끽 희화화 제정신 아냐,Politics
대통령실   연이어 발사 전략적 함의 커,Politics
레드라인 도발에한미 밀착  대북노선 시험대,Politics
강용석과 단일화 대신 투표율 김은혜 사전투표 간절,Politics
이재명 손으로 목 긋는 동작에이준석 제정신 아닌 행동,Politics
노마스크 열병식 탓  코로나 사망 군인 줄잇나,Politics
공항서 체포됐던 김규현 세월호 보고 조작 의혹에 동의 못해,Politics
굴종외교는 없다대북강경 한미공조 시험대,Politics
바이든 귀국길에  미사일 핵대응 메시지에 불만 표시,Politics
윤호중 편향된 언론부정확한 여론조사 국민 선택 혼란스럽게 해,Politics
에 인사검증 맡긴 정부민주 법무부가 국가사정사령탑 되겠다는 선언,Politics
대통령실 공직자 추천은 대통령실 검증은 법무부 적절,Politics
쇄신 소리에 중진들 반발비공개회의서 거친 고성 오가,Politics
강용석 김은혜가 단일화 거부선거 끝까지 지지율 확인할 것,Politics
대통령실 법무부 인사검증 논란에 대통령실은 정책중심,Politics
박지현 팬덤정치로 정권 잃어 용퇴하라 전면쇄신 촉구,Politics
김동연김은혜 차 초박빙 부동층  막판변수,Politics
내 몸엔 민주당의 피 국회의장 후보 김진표 발언 논란,Politics
평화 위협 중대 도발대통령  주재하며  도발 강력 규탄,Politics
 지도부 충남 총출동충청권 승기 잡기종합,Politics
노영민 과 퇴임열차 탄 사람이번엔 충북 권력교체 이룰 것 지방선거  충북지사 후보 인터뷰,Politics
강용석 단일화 가능성 이제 없다김은혜측 조건 수긍 안해,Politics
북  화성형 등 발 섞어쐈다한미 미사일 대응사격종합,Politics
 바이든 전용기 뜨고 시간 만에 미사일 섞어쏘기 도발,Politics
민주 투톱 자중지란 이게 지도부냐  다양한 의견 내야,Politics
박지현  퇴장에 민주 내분비공개회의 고성 오가,Politics
 법사위원장 사수 총력전민주 다 먹다간 탈난다,Politics
김민석 박지현 사과에 보기에 따라 돌출행동,Politics
박지현 진압 나선  지도부 개인 의견일 뿐,Politics
  등 발 섞어 발사한미 미사일 대응사격종합,Politics
김은혜 일할 기회 약속 지킬 기회 달라사전투표 독려,Politics
년만에 육사출신 합참의장 연합사 중용 동맹 강화 기조,Politics
바이든 귀국 비행 중에   쐈다,Politics
인사 검증 거머쥔 한동훈민주당 검찰의 국정장악 시도,Politics
 법무부 인사정보관리단 신설은 위법사정 칼날도 모자라 인사 총구까지 넘기나,Politics
지도부 중원 집결힘센 여당 세몰이 총력,Politics
뉴스포커스 한동훈 직속 공직자 검증야 검찰공화국,Politics
건희사랑 팬클럽 회장 사진 직접 받는 이유 그건,Politics
 카디즈 진입 중러훈련 영상 공개무력시위 메시지 부각,Politics
위기감 느꼈나 이재명 목에 손 갖다대며 이번 선거 지면 정치생명 끝,Politics
영상 목에 손 갖다대고 끽 절박한 이재명의 호소,Politics
뉴스포커스  탄도미사일 발사윤대통령 첫 대통령주재  소집,Politics
  미사일 섞어 쏜 듯 한미 대응 사격,Politics
배두헌의 현장에서 세 박지현의 정치실험,Politics
 탄도탄 발 연속발사와 미사일로 맞대응 무력시위,Politics
 지방선거 격전지  포진한 신도시권 파주  우세지역 흔들릴까,Politics
 퇴장 박지현 후폭풍회의서 터진  중진들의 고성,Politics
송영길   오세훈 김동연   김은혜 ,Politics
 바이든 비행기 뜨고 시간 만에 미사일 섞어쏘기,Politics
장제원 법무부 인사검증 논란에 한동훈 더욱 몸 낮춰야,Politics
북한 코로나 사망자  약물부작용으로 숨져,Politics
기자수첩 박지현의 용기를 외면하는 민주당,Politics
건희사랑 팬클럽 회장 알던 사이김건희 여사는 최상급 인간,Politics
용퇴론 두고 박지현 민주당 지도부와 파열음,Politics
윤핵관 장제원 한동훈 소통령 논란에 우려 겸허히 받아들여야,Politics
한동훈이니까 문제진중권 법무부 인사검증 또 갈등 생길 것,Politics
이준석 지면 정치생명 끝 이재명에 제 정신 아냐,Politics
국힘 민주당 사과 이재명송영길윤호중부터 사퇴하라,Politics
미사일 도발 징후에  완전무장 전폭기 여대 출격훈련킬체인 능력 과시,Politics
김기현 대선 패배 인방 사퇴해야이재명송영길윤호중 저격,Politics
윤석열표 시계 첫선깐부 할아버지 등 받아,Politics
 바이든 뒤통수에 핵탑재 가능 북한판 이스칸데르 섞어쐈다,Politics
레이더 계양을 사수로 뜬 윤형선 후보 직격인터뷰,Politics
혼전의 계양을이재명 비공개 유세윤형선 광폭행보,Politics
단독 국방부 중국러시아 군용기 카디즈 진입에 유감 표시,Politics
바이든 하늘에 있는데 미사일 쏜 북한 왜메시지라 생각,Politics
권성동  정부 출신 윤종원 국조실장 안돼  인사에 반기,Politics
정부 첫 대장인사서 육사 부활육군대장 명 중 명이 육사,Politics
이재명 일정 비우고 숨 고르기지지율 하락에 궤도수정하나,Politics
바이든 귀국길에 미사일 쏜  대통령실 도발 시점 주목한 이유,Politics
영상 박지현 다시 작심 발언  용퇴 필요최강욱 징계 조속히 마무리,Politics
고민된다던 김은혜 강용석과 단일화서 한 발 뺐다,Politics
이재명 손으로 목 그으며 지면 끝장이준석 제정신이냐,Politics
북중러 동시 도발 심상찮은 한반도,Politics
김규현 대통령 국정원장 절대 국내 정책 관여 말라 엄명 내려,Politics
김기현 박지현 사과 선그은  국민에 사과할 일 없단 속내,Politics
민주당 또 속였다종부세 감면 아닌 부담 증가 국힘 맹비난,Politics
권성동 대통령에게 윤종원 우려 전달대통령 고심 중,Politics
무등의 아침 조오섭 이재명 등판 효과 있다박지현 회견 내용 몰랐다,Politics
여론조사 교육감 김광수 이석문  초접전,Politics
여론조사 종합 을 보궐 오차범위 교육감 초접전,Politics
뉴스킹 조원진 민주당 명분 잃었어이재명 계양 아닌 서울시장에 나갔어야,Politics
 동해상에 미사일 실사격 활주로 운집했다,Politics
김동연 경기 동남부 순회기호 번으로 독주 저지,Politics
또 뒤집혔다김동연   김은혜 ,Politics
한미   추정 발사에 지대지미사일 사격,Politics
개월된 해군총장도 교체정부 육해공 수뇌부 통째 바꿨다,Politics
이재명 이번에 지면 정치생명 끝목에 손 그으며 끽영상,Politics
이준석 충청권 지방은행 필요권성동  충남 지원 약속,Politics
노영민 충북은 균형추 맞춘다수도권 중심 에 경고,Politics
김영환 노영민 과 퇴임열차 탄 사람충북 권력교체 이룰 것,Politics
북한 올해 번째  발사화성형 전력화에 총력,Politics
여론조사 을 보궐 김한규부상일 오차범위 접전,Politics
여야 법사위원장 놓고 으르렁국민의힘 민주당 과거 합의 헌신짝 취급,Politics
대통령  추정 미사일에 한미 확장억제 실질조치종합,Politics
민주당 대 여성 팬덤 그냥 즐기고만 있다,Politics
도발에 도 지대지미사일 사격공군은 무장  활주훈련,Politics
조국의 강 건넜지만 바지 안 젖은 민주당 박지현은 용기있다,Politics
고립무원 박지현 용퇴론에  비대위 내분 격화,Politics
  추정 미사일에 한미 확장억제 실질조치,Politics
위기의 이재명개딸 유세 대신 골목서 바닥 민심 훑는다,Politics
북  화성형 등 발 섞어쐈다한미 미사일 대응사격,Politics
민주당 지도부  용퇴쇄신 놓고 이견이게 지도부냐 고성도,Politics
지방선거  경기 초접전김동연김은혜  미만 격차도,Politics
군 북 동해 상으로 탄도미사일 발 발사,Politics
 용퇴론에  분열 박지현 윤호중 무엇이 맞는지 숙고해야종합,Politics
김은혜 민주당의 변화 읍소 믿지 않아사전 투표로 일 할 기회 달라,Politics
법무부가 인사 검증 소통령 현실화 맹폭  한동훈이라 비판하나,Politics
광주 서구청장 선거 무소속 현직  민주당 신인 각축전,Politics
윤 대통령 세종 첫 국무회의 지방선거 최대변수 부상,Politics
팬덤정치 결별 용퇴 박지현 소신 발언에 선 긋는 윤호중과 선대위,Politics
김규현 대통령 국정원 절대 국내 정책 관여 말라 엄명 내렸다,Politics
박홍근 박지현 사과 사전 논의 없었어쇄신안 금시초문,Politics
 정부 군 수뇌부 일괄 교체첫 합참의장에 김승겸 내정,Politics
일타이피 안철수 나보고 사골 우린다는 이재명김혜경 때문에 소에 집착,Politics
지방선거 코앞에 두고  용퇴론 또 꺼낸 박지현박홍근 금시초문 사전 상의 없어,Politics
 기념품 호 손목시계 공개역대 대통령 시계 어땠나,Politics
김민석 이재명 계양을 연고 없으나 결국 초반 차이 정도는 벌릴 것,Politics
김기현 이재명 인천 계양에 세금 내본 적 있나,Politics
권성동 등  원내지도부 출신 윤종원 반대 의견 모아,Politics
권성동 삼성현대차 등 조 투자발표이게 정권교체 효과,Politics
고립되는 박지현 용퇴쇄신 진격에 싸늘한 지도부,Politics
자격 없다 권성동 비판에김진표 말 끝까지 들어야,Politics
시민단체 반부패수사대 외압에 굴복 말고 성상납 이준석 구속하라,Politics
 검찰의 국정장악 시도법무부 상왕부처 소통령 한동훈,Politics
 바이든 뒤통수에  도발한미 압박에 무력시위,Politics
김기현 원구성 재협상 민주 주장에 얼토당토 않은 궤변,Politics
윤호중 이게 지도부냐 책상 쾅박지현 날 왜 뽑아 앉혔냐,Politics
기념품 호  대통령 시계 공개깐부 오영수 등 명에 선물,Politics
권성동 기업들 조 투자계획이게 바로 정권교체 효과,Politics
 장단거리 미사일 섞어 쐈다 한미일 동시 타격 능력 과시,Politics
뉴스라이브 법무부가 인사검증까지한동훈 소통령 현실화,Politics
목에 손 긋는 이재명 이번에 지면 정치생명 끝 영상,Politics
대통령  추정 미사일에 한미 확장억제 조치 이행,Politics
뉴스라이브 바이든 못 만날뻔한 박병석 버럭한 사연은,Politics
특보 합참 북한 동해상으로 탄도미사일 발 발사,Politics
법무장관 직속 인사검증 민주 반발 한동훈 영원히 장관 안 한다,Politics
조수진 이재명 덕분에 호남 뺀 개 단체장 국회의원 곳 전승도 가능,Politics
구혁모 국힘 화성시장 후보 군공항 폐쇄가 우선인터뷰,Politics
뉴스킹노웅래 윤호중 박지현 사과 말렸으면 못하게 했어야공동비대워원장으로서 무책임,Politics
용퇴론 또 꺼낸 박지현아름다운 퇴장 준비해야,Politics
김기현 박지현 사과 번복  국민에게 사과할 일 없다는 속내,Politics
영상 박지현  아름다운 퇴장 준비해야,Politics
고립된 박지현 용퇴 논의해야에 윤호중박홍근 반대,Politics
이재명 이번에 지면 끝장 목에 손이준석 제정신 이냐 이성 찾길,Politics
이슈앤 직설 코앞으로 다가온 지방선거국힘 안정론  민주 견제론,Politics
박지현 당내 그룹 퇴장 준비해야박홍근 박 위원장 쇄신안 발표 금시초문,Politics
 장성인사 육사 화려한 복귀김승겸 합참 박정환 육참,Politics
민주당이 안보인다구원투수 이재명도 흔들,Politics
새 합참의장에 김승겸 내정  대장급 명 교체종합,Politics
박남춘 수도권매립지 년까지 연장 이면합의 비판,Politics
권성동 섣부른 낙관주의는 패배여론조사 투표로 이어져야,Politics
이재명 이번 선거에 지면 정치생명 끝장 지지 호소 영상,Politics
진중권 한동훈에 민정수석 권한까지이게 개혁 맞나,Politics
송영길 오세훈에 찍혀 해고된 국장 있어 명백한 허위사실,Politics
송영길 서울형 코인 만원이 만원 될 것루나와 달라,Politics
전여옥 민주당이 대중정당개딸한테 이재명만 파는 식당,Politics
내부 총질 싸늘한 반응에도 박지현 그룹 용퇴해야 직격,Politics
장제원 인사검증 법무부 이관 논란에 한동훈 우려 겸허히 받아들여야,Politics
건희사랑 강신업 김 여사가 건넨 사진 공개하면 좋네요 회신도,Politics
이재명 안철수 맹물밖에 안 나올 사골  부인 탓 소에 집착하나,Politics
영상 이재명 손으로 목 그으며 패하면 정치생명,Politics
호주 총선 결과로 대두하는 적록연정 가능성에 주목하자,Politics
양낙규의  윤석열 첫 대장인사는 육사의 부활,Politics
노웅래 박지현 사과 국민에 진심 전달하는 것당 쇄신 뜻 담아,Politics
오징어게임 오영수씨 등 대통령 시계 받는다 명에게 선물,Politics
한동훈 영원히 법무장관 하나 하태경 소통령 지적 일축,Politics
북 탄도미사일 발 발사윤석열 정부 첫  소집,Politics
민주당 지도부 우왕좌왕박지현 용퇴론 등 쇄신안에 박홍근 금시초문,Politics
영상 이재명 목에 손 갖다대고 이번에 지면 정치생명 진짜 끽,Politics
중러 군용기 독도 인근 카디즈 무더기 진입의도는,Politics
법무부 인사검증 논란장제원 한동훈이 장관이라  비판,Politics
강릉시장 후보자 토론회 내가 적임자날 선 공방 설전,Politics
민주 한동훈 딸 스펙비리 조사특위 설치정부와 전면전,Politics
윤석열 정부서 부활한 육사 라인,Politics
박지현 대선 졌는데 내로남불 여전 성폭력 반복 팬덤정치 심각,Politics
박지현 국민의 신뢰 위해 정치인 용퇴 논의해야,Politics
윤태곤의 판 왜 박지현은 민주당에서 고립되었나,Politics
취임식 국민희망대표 초청 윤석열 대통령 시계 호 증정,Politics
성비위 의혹 김원이  정부 맹폭전두환 신군부보다 더한  신검부 출현,Politics
중러 군용기 카디즈 무단 진입 정부 유감 표명,Politics
지선 이준석 년 무한책임론지지해달라오세훈김태흠  협약,Politics
강용석 김은혜와 단일화 가능성 없다 대통령 통화 노코멘트,Politics
윤대통령 첫  소집 새 정부 대북정책 시험대,Politics
박지현  정치인 사명 다했다용퇴하고 팬덤정치 끝내야,Politics
김민석 박지현 대국민 사과 지도부에서 정리 안 된 것,Politics
도발 타이밍 기다렸다김정은 바이든 순방 직후 미사일 발사,Politics
박지현 팬덤정치 굴복 안돼 용퇴최강욱 징계 조속히,Politics
이재명 이번에 지면 정치생명 끝장난다손으로 목 그으며 끽,Politics
안철수 내가 사골 우린다고 이재명 부인 때문에 소에 집착하나,Politics
여당 문 정부 수석 출신 윤종원 불가론 제동권성동 있을 수 없어,Politics
국민의힘 이재명김동연에 화력 집중민주당 김은혜 역공,Politics
박지현 국민 신뢰 위해  물러날 때아름다운 퇴장 준비해야,Politics
박홍근  민정수석 폐지 핑계로 한동훈에 전권 몰아줘,Politics
중러 전투기 카디즈 무단 진입한미동맹에 무력시위,Politics
강용석 단일화 않고 완주 김은혜가 거부하니선거 후 정치행보 결정,Politics
대통령  국가 연주에 가슴에 손 민주 외교 초보 대통령 좌충우돌 비판,Politics
박지현  사명 끝나 퇴장해야 박홍근 선거 앞두고 분란 우려,Politics
민주당 저희 잘못 회초리 맞겠다국힘 평가절하,Politics
정부 첫 합참의장에 김승겸 내정년만에 육사 출신종합보,Politics
장제원 법무부 인사검증 논란에 한동훈이 영원히 장관하나,Politics
뉴스킹 한국  합류연임 앞둔 시진핑 사드 때처럼 보복할까,Politics
새 국무조정실장에 윤종원 기업은행장 사실상 확정,Politics
윤호중 정부 막장불통 국정 견제할 수 있게 에 힘 달라,Politics
이준석 민주 입법폭주로 국민 지탄 받으면서 국회 일방운영 기획 제정신 아니다,Politics
박홍근 박지현  용퇴 분란보다 선거에 집중할 때,Politics
부산 강서구 노기태김형찬 연일 난타전과열 양상,Politics
 법무부 인사검증에 정부 민정수석실 비정상의 정상화,Politics
