titles,category
총리 강력추천 윤종원권성동 대통령에게 인선 우려 전달,Politics
격분 황운하 또 폭탄발언 한동훈의 검찰판 국정농단 벌써부터 우려,Politics
 방탄조끼 입으려다 성난 민심에 폭탄 맞아,Politics
계양을 윤형선 선거운동원 등록한 이준석사전투표도 계양에서 한다,Politics
여야 추경 협상 분만에 파행 니들끼리 하세요,Politics
단독 조국 고발한 시민단체 대표  비례 등록 땐 운전기사,Politics
이재명 목에 손 그으며 끽이준석 제 정신 아냐,Politics
법무부 인사검증 담당 후폭풍여야 소통령 한동훈 다시 대치 조짐,Politics
제주시을 보궐 김한규 사퇴단일화 질문에 김우남 강력 반발,Politics
박홍근 개인으로 있는 자리 아냐박지현 그럼 왜 날 뽑았나,Politics
오세훈 이재명 선거 똑 떨어지고 반성 안해더 다듬어져야,Politics
문 전 대통령 사저 찾은 이낙연 출국 계획 보고했다,Politics
계양을 초접전에이재명 전국 유세 대신 골목 민심 훑는다,Politics
 용퇴론에 이준석 김남국고민정 세상이 대안인가,Politics
합참의장에 김승겸 내정년 만에 육사 출신,Politics
박지현  아름다운 퇴장 준비해야민주당 발칵,Politics
인사도 쥔 검찰라인안기부 부활 공포 키운 장제원 한마디,Politics
정부 임명 육해공군 참모총장 다 교체됐다육사 부활 평가도,Politics
오세훈 이재명 정치적 도피처 마련하려 계양으로 간 것,Politics
김규현 청문회  세월호 보고 조작 집중추궁 엄호종합,Politics
김규현  코로나 통계 믿기 어려워스스로 비핵화 의지없어종합,Politics
전원책 한동훈 왕장관 논란에 바보짓박지현 사과는 배후 있어,Politics
독기 품은 김동연 혼탁한 정치판에 분노 경기부터 바꾸겠다 지방선거,Politics
친문과  사저 찾은 이낙연  출국 계획 보고드렸다,Politics
원조 윤핵관 장제원권성동  내각의 한덕수한동훈당정 간 긴장기류,Politics
떠나는 바이든 뒤로미사일 발 쏜 ,Politics
 데일리안 퇴근길뉴스 이재명 손으로 목 그으며 이번에 지면 끽이준석 제정신 아냐 등,Politics
 도발 맞서한미 미사일 대응발사 전투기 여대 엘리펀드 워크,Politics
분 만에 대통령 보고 시간 뒤 미사일 맞대응달라진 정부 여기는 대통령실,Politics
문재인 사저 찾은 이낙연 출국 계획 보고드렸다,Politics
너희끼리 하세요  나도 못하겠다여야 차 추경안 진통종합,Politics
민주 네거티브 합작 후원금 의혹 반박김은혜 측 물음표 여전,Politics
 지도부 최대 격전지 충청 총집결 텃밭 다지기도종합보,Politics
경북지역에 되살아난 돈 선거 망령 언제까지,Politics
민주 소통령 현실화  국민의힘 다각도 검증 가능,Politics
 지도부 충남 총출동 김태흠으로 정권교체 완성하자,Politics
한동훈 소통령 비판에 법무부 인사검증 권한 아닌 책임,Politics
양산시장 민주당 김일권 후보  사저 입주에도 고전,Politics
만명 서울 민심 부동산이 가른다 신통기획   누구나집,Politics
 정부 출신 윤종원 국무조정실장 인선 당정갈등 불씨로,Politics
여심야심 이대녀 비대위원장의  용퇴 주장에 민주당 발칵선거 앞 파열음,Politics
황교익 부부합창단 사진  동급국민의힘 좀스럽다,Politics
윤석열 정부 첫 대장 인사서 육사 부활경북 출신 명 포함,Politics
 법무부 인사정보관리단 한동훈 소통령 등극 레드카펫종합,Politics
 자중지란책상 쾅  이게 지도부냐  나 왜 뽑았나종합,Politics
시 썰전라이브 이재오 인사검증 조직 총리실에 만들어야법무부는 부적절,Politics
찢어진 조국흑서팀서민 진중권 손절 선언 예의 없어,Politics
김동연 측 김은혜는 청담동 주민 억 전세 분당살이 해명하라,Politics
한미일 채찍론에  강대강 맞불한반도 다시 먹구름,Politics
 조기 출근으로  속행 도발 새 정부 안보 태세 시험 의도,Politics
여유로운 국민의힘무기력 민주당 원사이드  지방선거 지역 경쟁력 잃나,Politics
이재명 목에 손 갖다대고 이번에 지면 정치생명 끝이준석 제정신 아냐,Politics
뉴스큐 지방선거 박지현  퇴장에 민주당 자중지란,Politics
김규현 검찰 귀국 요청 불응에 죄송하다 사과,Politics
제주지사 오영훈 앞서고 제주시을교육감은 초접전,Politics
제주을 국힘 부상일   민주 김한규 ,Politics
정부 경제수석 국무조정실장 내정에 반대 문자 와서 고심중,Politics
 여론조사 이재명  윤형선김병관 안철수 ,Politics
영상  바이든 귀국길  선물 미사일 맞불,Politics
윤  긴급 소집북 차 핵실험 준비,Politics
북한 탄도미사일 발사 바이든 귀국길 맞춘 의도적 타이밍,Politics
이준석  취임 후 짧은 시간에 세상이 바뀐 것 같다,Politics
기념품 호 시계 전달깐부 오영수 집무실 참 소박종합,Politics
이재명 지면 정치생명 끝장 끽이준석 제정신 아닌 행동,Politics
 겨눈   겨눈 섞어쏜  다음은 핵실험이다,Politics
선거 직전 집안싸움 민주당 용퇴  이게 지도부냐영상,Politics
사저 찾은 친문들 보수 유튜버 확성기 시위 일상 파괴 멈춰라,Politics
  한미일 겨눈  동시 도발 확장억제 실질조치 지시,Politics
윤 정부 대장급 인사는 육육영문 정부 대장 명 모두 물갈이,Politics
미군 전략자산  폭격기  상공서 포착한반도 접근 안해,Politics
서민 진중권 손절 선언 기본적 예의 없어 상대하고 싶지 않다,Politics
한덕수가 뽑은 윤종원 권성동 안돼당정 인사갈등 불붙었다,Politics
뉴스 장정희 후보 녹색의 가치 아이들을 위한 가치,Politics
 수석 출신 윤종원 인선에 불가론 제동우려 공개표출종합,Politics
  등 연속발사는 연쇄도발 신호탄 차 핵실험 다가온다,Politics
기폭장치 시험  핵실험 임박 동향한미 대응논의 착수,Politics
대통령실  차 핵실험 준비 임박 위협 땐 한미 핵우산 실체적 이행,Politics
불법체류 개월 비난에고개숙인 김규현,Politics
 국민희망대표 인에 대통령 기념시계 직접 증정여러분 덕분,Politics
윤 대통령 국민대표에 기념시계 첫 선물집무실 초대해 오찬,Politics
홍준표는 저녁형 인간 경쟁 후보 공격에 하루 일정 빼곡,Politics
박진 도발에 안보리 신규 제재 조속 채택해야종합,Politics
의 힘으로 김은혜김태흠 윤심 강조국민의힘 충남 총출동,Politics
박대출 민주당 콩가루 집안 같아 팀킬 난무박지현 두둔,Politics
대통령실  한미에 전략적 메시지차 핵실험 임박종합,Politics
황교익  부부합창단 사진에 과 동급 비난국힘 대변인이 올린 사진은,Politics
민보협 회장 박지현 비판 의원들에 본인은 사과라도 했나,Politics
김규현  국정원 정치개입 말라 엄명세월호 조작 동의못해,Politics
북한은 오늘도 미사일을 근데 국정원 간부가 없다 안보공백,Politics
인천 계양을 이재명 윤형선  오차범위 내 접전한국갤럽,Politics
서오남 비판 벗을까 교육부복지부 여성 장관 가능성에 관심,Politics
한미 새 대북제재 조속히중러에 막힌 안보리 움직일까종합,Politics
여의도번지 지방선거  여야 격전지로민주 지도부 파열음,Politics
이준석 일 인천 계양서 사전투표윤형선 선거운동원 등록도,Politics
대통령실  도발 의도 국내 정치일정 개입하려는 게 아닐지,Politics
윤형선에 힘 싣는 이준석 계양서 선거운동원 복장입고 전력투구,Politics
뉴스큐  바이든 떠나자  도발차 핵실험도 임박,Politics
 집무실 찾은 깐부 청와대 보고 용산 와보니까,Politics
여야 추경안 협상 진통 증액지출구조 검토 계속종합보,Politics
박지현 또 작심 발언 어느 당 대표가 합의 거쳐 회견문 쓰나,Politics
임태희 전교조 때리기성기선 삼청교육대 시절로 회귀하나,Politics
지방선거 김은혜김동연 초접전에 네거티브 과열,Politics
대통령실 북한 핵기폭장치 작동시험 탐지 차 핵실험 임박,Politics
박지현 어떤 난관에도 흔들림 없이 가겠다,Politics
뉴스썰기 그사람 안돼요윤멀관 권성동 반발 진짜 이유는,Politics
단독조국 사의표명 했다는데서울대는 받은적 없다,Politics
김규현 국정원장 후보자 세월호 보고 조작 의혹에 동의 못해,Politics
국정원장 청문회 세월호 보고시간 조작 여부 공방전,Politics
사사건건 시비박남춘유정복 이번엔 재산 문제로 으르렁,Politics
 검찰의 국정장악 시도법무부 상왕부처 소통령 한동훈,Politics
 요청에  전략 자산  핵 폭격기 한반도 전개,Politics
민주당 내분에 국민의힘 콩가루 막연한 용퇴론 지방선거,Politics
바이든 순방 직후 탄도 미사일 잇따라 발사한 북한의 속내,Politics
 대통령 국정지지율  상승세지방선거 정부 안정론 ,Politics
한미일 결속에 은 으로 맞서치솟는 한반도 긴장지수,Politics
선거 완주 의지 다진 강용석 김은혜가 단일화 거부 끝까지 최선,Politics
현장 김태흠 윤석열 시대는 충남에 기회이준석 추진력 하면 김태흠,Politics
여기가 바이든 앉은 곳 국민대표 명에 즉석 집들이,Politics
 판세 분석 신경전조수진 호남 제외 석권 가능이준석 언급 신중하라,Politics
서울코인 준다는 송영길 만원짜리만원 루나와 다르다,Politics
토리 아빠 대통령 강아지 집무실 구경 아직오줌 쌀까봐,Politics
대통령실  차 핵실험 마지막 준비미사일 핵투발 성능 개량,Politics
김건희보다 박지현 더 싫어 분노한 개딸들 사퇴 촉구,Politics
미군과 섞일라 바이든 있을때 섞어 도발 안한 까닭,Politics
최영일의 시사본부 김성환 민영화 논란 아니 뗀 굴뚝에 연기 나랴 연기 피운 사람이 대통령 비서실장,Politics
강용석 김은혜가 단일화 거부하는 상황국힘 복당 생각 없어,Politics
차 추경안 처리 난항여야 조  조,Politics
이재명  윤형선  접전안철수  김병관 ,Politics
지방선거 앞두고 대구 도심 군부대 이전 논의 재점화,Politics
대통령실  차 핵실험 임박핵기폭장치 작동시험 탐지종합,Politics
 용퇴론에 이준석 김용민김남국고민정 세상김남국 성상납 의혹은 없어종합,Politics
 미사일 발사버튼 누르자마자 대통령에 보고중장기 대책 이미 준비,Politics
대통령실  발사한  핵 기폭장치 작동시험 탐지핵실험 임박,Politics
권력 집중 한동훈 비판에 국힘 집중 엄호측근이라야 가능한 체제 지적도,Politics
이준석 이재명 지면 정치생명 끝장 끽 희화화민주 성상납 해명이나 하라,Politics
하태경 세월호 국정원 소유 괴담 퍼뜨린 이재명 엄벌해야,Politics
민주 소통령 한동훈 장관에게 모든 권력 몰아주려 작정했나,Politics
강용석 김은혜와 단일화 가능성 없어양당 후보 함량 미달,Politics
김동연 캠프 족벌신문 조선 선거개입 중단하라 촉구한 까닭,Politics
자신감 오른 국힘 지도부 낙관 절대 금물,Politics
이재명  윤형선 김병관  안철수  갤럽,Politics
 섞어쏘기 한미동맹 동시위협 핵기폭장치 시험 탐지,Politics
윤석열 정부 첫 인사 파격막 바뀐 해군총장까지 교체,Politics
박지현 자기 정치하냐 비판에 어떤 난관에도 흔들림없이 가겠다,Politics
이재명  윤형선 다윗과 골리앗 초박빙 접전,Politics
깐부 오영수 집무실 둘러본 뒤 청와대와 비교하니,Politics
군 북 동해 상으로 탄도미사일 발 발사,Politics
조수진 호남빼고 석권 가능성이준석 섣부른 선거전망 지양,Politics
영상대통령실  차 핵실험 임박기폭장치 시험 탐지종합,Politics
토리 아빠  대통령집무실에는 반려견과 함께 촬영한 사진,Politics
예결위 여야 간사 추경안 협상 무산 추가 조정 필요종합,Politics
권성동 윤석열 대통령에게 윤종원 국무조정실장 인선 반대 전달,Politics
현장 골목시장서 민심 확보 나선 오세훈 동작구 강남 구로 만들 것,Politics
김동연 고액 후원금 놓고 김은혜김동연 날선 공방,Politics
이낙연 부부 만나  출국 보고마을식당서 점심도,Politics
정부 인사에  모두 불만 윤종원 안돼  법무부 인사검증 안돼,Politics
권성동 윤종원 국조실장 임명 반대 에 전달이준석 불협화음 아냐,Politics
원 구성 협상에 묻힌 하반기 국회의장 선출 난항,Politics
총리가 강력 추천한 윤종원 권성동은 강력 반대결론은,Politics
이재명 연고 아닌 능력 선택해달라 투표하면 이겨,Politics
이준석  빠진 민주당 고민정김남국김용민 세상,Politics
국힘 윤종원 불가 한목소리정부와 대척점 선 인물,Politics
박지현  용퇴에  발칵친문은 이재명 면피용 의심,Politics
정부 보름만에 수뇌부 명 물갈이육사 부활 기조 뚜렷,Politics
이게 지도부냐 윤호중 책상 쾅박지현 그럼 날 왜 뽑았나,Politics
민변 한동훈 직속 인사정보관리단 신설 검찰독재국가로 가려는 것,Politics
예결위 여야 협의 분만에 파행 니들끼리 하세요,Politics
북 미사일 발사에 강릉 군부대서 즉각 맞대응 사격,Politics
역전 당한 이재명 조사 신뢰도 놓고 와글이슈시개,Politics
울산서 년만에 여성 기초단체장 탄생할까,Politics
김은혜 경기도의 기회 사전투표 독려단일화는 안갯속,Politics
기폭장치 시험 등  차 핵실험 임박한미 연합대응 가동,Politics
이준석 민주 다 먹다가 탈난다법사위원장 사수 신경전,Politics
이앤피 민주당 지지자 김건희보다 박지현이 더 싫다 자유한국당 전철,Politics
 민영화 반대 문자 보낸 송영길에 선거용 제의 생태탕,Politics
 풍계리서 기폭장치 실험실제 핵 실험 초읽기는 아냐,Politics
대전 선거전 이전투구 양상비방흠집내기에 고소고발까지,Politics
북한 올해 번째  발사화성형 전력화에 총력종합,Politics
이재명측 가짜 계양사람 윤형선 오늘은 목동에서 안 주무셨나,Politics
접전 판세에 이재명 연고 아닌 능력 선택해달라,Politics
더뉴스 여야 꼬이는 원 구성한동훈에 민정수석 권한,Politics
국정원장 청문회세월호 보고시간 공방 전 정권들과 차별점 요구,Politics
 대통령 여소야대 정국 시행령 정치로 돌파하나,Politics
이슈현장 북 올해 번째  발사바이든 순방 직후 도발,Politics
대통령실  차 핵실험 사전 준비기폭장치 실험 탐지종합,Politics
 호 시계 받은 국민대표들 집무실 와보니 포착,Politics
문재인 사저 찾은 이낙연 부부 출국 계획 보고드렸다,Politics
쿼드는 아시아판 나토  힘 통한 현상 변경 막는 건 당연,Politics
지방선거 김동연   김은혜 ,Politics
이앤피 김은혜  채용청탁 의혹 신경민실패한 민원 장예찬부정청탁 아냐,Politics
대통령실 북 차 핵 실험 임박핵 기폭장치 작동 시험 탐지,Politics
민주당 내분 속 박지현 엄호 목소리도당이 문제,Politics
예결위 여야 간사 협의 파행 여야 조  조종합,Politics
꿈적 않는 민주당에 화낸 박지현 노무현 정신 어디갔나종합,Politics
깐부 오영수 청와대 보고  집무실 봤더니 차이는,Politics
포린폴리시  기존 외교 문법 못 벗어날 것 세부 비전 안 보여,Politics
무장공비 토벌 김승겸정부 첫 합참의장에,Politics
 용산 집무실 찾은 깐부 할아버지의자 뒤 반려견 토리 사진도,Politics
 총력전에 격전지 된 계양을 낙승 노린 이재명 곤혹,Politics
단독 이준석 계양을 윤형선에 힘싣기사전투표 계양에서 한다,Politics
박지현 어느 당 대표가 당내 합의 거쳐 기자회견문 쓰나,Politics
더뉴스 박지현의 호소문당 안팎에서 쏟아지는 비난과 응원,Politics
김건희 여사 요청으로 팬클럽 만들어 증발 논란이슈시개,Politics
이준석 이재명 정치생명 끽 희화화 성상납 해명이나종합,Politics
유기견 토리 막내 써니대통령 국민희망대표에 대통령 시계 선물,Politics
박대출 콩가루집안 민주당개딸 반개딸친현 반현 쪼개져,Politics
윤종원 공개 반대이준석 당정갈등 우려에 불협화음 아냐,Politics
대통령실  차 핵실험 임박핵기폭장치 작동 시험 탐지,Politics
선거 앞  퇴진 말했다가코너 몰린 년생 박지현,Politics
윤 대통령 첫  주재실질적 조치 이행 지시,Politics
김규현 국정원장 후보자 세월호 보고 시각 조작 안했다,Politics
박지현 팬덤정치와 퇴장해야  정청래 전시에는 총구를 밖으로,Politics
속보영상 국정원장 후보자 대형사고 났을 때 대통령은 법적 책임 없어,Politics
이준석  용퇴 김남국김용민고민정 세상 될 것,Politics
속보 대통령실  차 핵실험 준비핵기폭장치 작동시험 탐지,Politics
정부 당정 첫 권력갈등권성동 에 정부 수석 윤종원 국무조정실장 반대,Politics
김태효 차장  기폭장치 실험 수차례핵 실험 임박한 단계,Politics
여론조사 영상 지방선거  최대 격전지 경기 승자는,Politics
전주혜 의원이 가져온 합의문의 내용은,Politics
국민의힘 후보 험지 광주서 상승세 돌파하나,Politics
 원구성 맹폭이준석 삼킬 수 있는 만큼 물어라종합,Politics
박지현  용퇴론에 이준석 대안은 김남국김용민고민정 세상인 거냐,Politics
이재명윤형선 초접전 벌이자 민주당 여론조사 부정확,Politics
이재명 측 가짜 계양사람 윤형선 오늘은 목동에서 안 잤나,Politics
한동훈이 아니었다면 진중권 법무부 인사정보관리단 문제 지적,Politics
대통령에 윤종원 반대 피력한 권성동이준석 당정 갈등 ,Politics
유정복 민주당 텃밭 계양부평에서도  앞서,Politics
이재명 출마 영향 없다 인천시장 선거 판세 뒤집기 멀어지나,Politics
 사저 평산마을 오죽했으면 집단항의집회소음 더 못 참아,Politics
스웨덴 한국전문가 욘손교수 정부 남북관계 정부와 별 차이 없을 것,Politics
이재명  윤형선 김병관  안철수  중앙일보 여론조사,Politics
월간중앙 특별초대석  정치 원로 한광옥의 윤석열 대통령에 대한 고언,Politics
김태효 오늘 쏠 거로 보고 잠들어안보부처 장관들엔 금주령,Politics
윤석열 시계 첫 공개대통령 날짜 숫자 다 빼고 심플하게,Politics
김우남 사퇴설 을 보궐 막판 쟁점화 영향은,Politics
대통령실  차 핵실험 마지막 준비단계 임박,Politics
한미 새 대북제재 조속히중러에 막힌 안보리 움직일까,Politics
이준석 민주당서  빠지면 김남국김용민고민정 세상,Politics
예결위 여야 간사 협의 분 만에 파행 니들끼리 하세요,Politics
이준석 대안 없이  용퇴 김남국김용민고민정 세상,Politics
차 추경안진통여야 예결위 간사 분 만에 회동종료,Politics
이준석  용퇴하면 김용민김남국고민정 세상,Politics
한미 미사일 응수 엘리펀드 워크도도발 대응 세졌다,Politics
김규현 국정원장 후보자 세월호 보고 조작엔 무조건 부인,Politics
전여옥 이재명 정치생명 끽 때리며 최강욱 이로 피날레 장식하더니이번엔,Politics
속보 대통령실  차 핵실험 준비핵기폭장치 작동시험 탐지,Politics
윤 대통령 때문에 취재 못한 기자들 가스총회 한밤중 대리 사과문 논란,Politics
 윤종원 국조실장 내정권성동  정부 수석인데 난색,Politics
이준석 대안 없이  용퇴 그럼 김남국김용민고민정 세상,Politics
선거 코앞인데 내분 휩싸인 민주당 구심점도 선거전략도 없다,Politics
민주당 텃밭 광주에서 진보정당들 제당 경쟁 치열국민의힘이 유력,Politics
국가안보실  미사일 도발은 정치적 메시지핵 기폭장치 시험 포착,Politics
 차 핵실험 임박핵기폭장치 작동시험 탐지,Politics
북  화성형 등 발 섞어쐈다한미 확장억제 확대 논의종합보,Politics
돈다발에 브로커 음식접대 허위보도까지 지방선거 목전 불법 기승,Politics
취임 개월 해군총장도 교체문재인정부 지우기 군 인사 단행,Politics
이준석 이재명 겨누자김남국 성상납 의혹이나 해명하라,Politics
외교부 중러 군용기 카디즈 진입에 외교채널로 유감 표명,Politics
권성동 윤종원 국무조정실장 제동 정부 잘못된 정책 인정하는 꼴,Politics
박지현 연이틀 퇴장 거론 윤호중 책상 쾅 치고 나갔다,Politics
박용진양이원영 박지현의 사과 고맙다부족하다면 함께 고쳐가겠다,Politics
북한 올해 미사일 도발 차례 중 차례 동해상으로 쐈다,Politics
한미도 미사일 발사  무력시위  전략자산까지 부르나,Politics
이재명 정치 희화화 그만 지적한 이준석 김남국 본인 의혹이나 해명하시길,Politics
윤석열 시계 나왔다호 증정은 국민희망대표 인,Politics
바이든 떠나자마자 중러에 이어  도발한반도 긴장 고조,Politics
박용진 박지현 옆에 서겠다 김정란 처럼회 쳐내려 철없는 여성 이용,Politics
윤호중 말 막하는 말꾼보다 일 잘하는 일꾼 필요,Politics
민주당 사실상 법사위원장 합의 파기이준석 다 먹다가 탈난다,Politics
민주당 법무부의 공직자 검증 위법소통령 한동훈으로 정권 견제 호소,Politics
북 처음 단거리미사일 섞어 쐈다한미도 맞불 발사,Politics
노컷체크폐기 공약 없다는 오세훈 사실일까,Politics
이준석 박지현  용퇴론에 김남국고민정이 대안인 거냐,Politics
김기현 박지현 사과  내부 반발에 이중플레이  안 달라져,Politics
법무부 인사검증에 국민의힘 비정상의 정상화 옹호소통령 한동훈 차단,Politics
김규현 북한 스스로 비핵화할 의지는 거의 없다,Politics
이재명 손으로 목 그으며 지면 끝장이준석 제정신 아냐,Politics
대통령 침실도 공개 속도 내는 청와대 개방,Politics
더뉴스 바이든 떠나자마자  미사일 발사배경과 의도는,Politics
박지현 연일  용퇴론윤호중 개인 의견 박홍근 금시초문,Politics
강용석 김은혜가 단일화 거부했다통화는 노코멘트,Politics
민주 비대위 갈등 표면화이게 지도부냐  의견 낼 수 있어야,Politics
경기만 이겨도 선방 지지율 침체에 무거워진 김동연 어깨,Politics
토리 아빠 대통령 집무실에 놓인 반려견 사진,Politics
검찰 왕국 전락  인수위 때 결정된 사안,Politics
이재명  윤형선 인천 계양을 혼전 양상,Politics
 집무실 찾은 깐부할아버지 청와대 보고 여기 보니까,Politics
민주 짤짤이 최강욱 징계 선거 뒤로 미뤘다박지현 달라진 게 없다,Politics
김건희 여사 팬클럽 회장에게 미공개 사진 보내는 이유,Politics
 이게 지도부냐  그럼 왜 뽑았나 정면충돌,Politics
권성동 기업 조 투자발표이게 정권교체 효과,Politics
이준석 대안 없는  용퇴론은 김용민김남국고민정 세상,Politics
이준석  용퇴하면 김남국김용민고민정 세상,Politics
함양군수 선거 무소속 돌풍 부나,Politics
 단거리미사일 섞어 쏘기 시전 한미일 동시 겨냥,Politics
김기현 박지현 선긋기 사과할 일 없다는 속내 김용태 본질 안 바뀌어,Politics
새 정부 들어서 북한 도발 대응이 달라지고 있다,Politics
  화성형 등 발 섞어 발사한미 미사일 실사격 맞대응,Politics
한미   추정 발사에 지대지미사일 대응 사격,Politics
북한 탄도미사일 대응 한국군이 쏜 현무는,Politics
민주 경기 누구도 예측 못한다 국민의힘 김은혜 당선 명확,Politics
권성동 윤종원 국조실장 내정에 정부 정책 옹호자 임명 반대 ,Politics
양낙규의  미전략자산 곧 한반도 전개될듯,Politics
단독 이스타항공 인수 형남순 이상직 횡령배임 심증 있다,Politics
 국민희망대표에 기념시계 선물여러분 같은 헌신에 사회 돌아가,Politics
여긴 바이든 의자 사진은 우리집 써니 국민대표에 시계 선물,Politics
김은혜 양평가평 유세 정부와 약속 지킬 것,Politics
윤호중 이게 지도부냐 책상 쾅박지현 그럼 날 왜 뽑았나,Politics
대통령 윤종원 우려에 고심 중,Politics
수단 가리지 않는 김건희 아우라 인터넷 펼쳐져 황교익 또 날세워,Politics
양낙규의  북한은 왜 발을 잇따라 쐈나,Politics
정치신인 대통령과 여의도 정치가 만났다등돌리면 파국,Politics
 유세 중 목에 손 갖다대는 영상 화제,Politics
계양을 승부처로 급부상이번엔 윤형선 가짜 농부 의혹,Politics
